{
  "schemaVersion": "phase9.lane-run-record.v1",
  "objectiveId": "OBJ-2026-04-22-001",
  "recordSeq": 18,
  "experimentId": "EXP-001",
  "analysisId": "AN-001",
  "taskId": "analysis-execution-run:AN-001",
  "manifestPath": "analysis/manifests/run-analysis.json",
  "scriptSha256": "abc123",
  "inputPaths": [
    "inputs/data.csv"
  ],
  "outputPaths": [
    "artifacts/result.csv"
  ],
  "runner": "other",
  "argv": [
    "analysis/scripts/safe-analysis.mjs",
    "--input",
    "inputs/data.csv",
    "--output",
    "artifacts/result.csv"
  ],
  "startedAt": "2026-04-22T23:00:00Z",
  "endedAt": null,
  "exitCode": null,
  "stdoutPath": null,
  "stderrPath": null,
  "provenanceHash": "prov-running-001",
  "status": "running"
}
